53973ca5-32cc-400c-b4f0-8b129fd3cd91:::{"id":"53973ca5-32cc-400c-b4f0-8b129fd3cd91","title":{"en":"A Yandere Girl Who Is Not Very Good at Being Yandere"},"altTitles":[{"ja-ro":"Yandere ga Heta na Yandere Musume"},{"ja":"ヤンデレが下手なヤンデレ娘"},{"it":"Una ragazza yandere che non è molto brava ad essere una yandere"}],"availableTranslatedLanguages":["en","fr","pt-br","id","vi","pl","it","cs"],"description":{},"links":{"al":"164261","kt":"yandere-ga-hetana-yandere-musume","mu":"6outdpw","raw":"https://www.pixiv.net/user/88005027/series/192857"},"originalLanguage":"ja","contentRating":"safe","tags":[{"id":"423e2eae-a7a2-4a8b-ac03-a8351462d71d","name":{"en":"Romance"}},{"id":"4d32cc48-9f00-4cca-9b5a-a839f0764984","name":{"en":"Comedy"}},{"id":"e197df38-d0e7-43b5-9b09-2842d0c326dd","name":{"en":"Web Comic"}}]}
e0a9e33b-6def-431b-87db-ae2b26a501a0:::{"id":"e0a9e33b-6def-431b-87db-ae2b26a501a0","title":{"en":"Rettoujin no Maken Tsukai"},"altTitles":[{"ja":"Rettou Hito no Maken Tsukai"},{"ja-ro":"Rettoujin no Maken Tsukai: Skill Board wo Kushi Shite Saikyou ni Itaru"},{"ja-ro":"Rettoujin no Maken Tsukai: Sukiruboudo o Kushi Shite Saikyou ni Itaru"},{"ja-ro":"Rettou Hito no Maken Tsukai: Sukiruboudo wo Kushi Shite Saikyou ni Itaru"},{"ja":"劣等人の魔剣使い"},{"ja":"劣等人の魔剣使い　スキルボードを駆使して最強に至る"},{"en":"The Reincarnated Inferior Magic Swordsman"},{"en":"Inferior Magic Swordsman: Using the Skill Board to Become the Strongest"},{"en":"Using the Skill Board as an Inferior Magic Swordsman to Become the Strongest"},{"en":"Use the Skill Board to Become the Most Powerful Swordsman"},{"ru":"Реинкарнация низшего магического мечника"},{"th":"การใช้สกิลบอร์ด เพื่อเข้าถึงการเป็นผู้ที่แข็งแกร่งที่สุดของนักดาบเวทมนตร์ผู้ต่ำต้อย"},{"zh":"劣等人魔剑使运用技能板成为最强"},{"zh-hk":"劣等人魔劍使　運用技能板成為最強"},{"en":"The Inferior Magic Swordsman"},{"ja-ro":"Rettoujin no Makentsukai"},{"ja-ro":"Rettoujin no Makentsukai: Skill Board wo Kushi shite Saikyou ni Itaru"}],"availableTranslatedLanguages":["fr","en","it","tr","id","pt-br","ru","pl"],"description":{"en":"A normal office worker, Toru Minasuki, was swallowed up by a dimensional fissure and reincarnated into a different world. Upon reincarnation, Toru was given a [skill board] by God. Make the most of it to acquire all the necessary skills! Even though he is an \"inferior person,\" he'll make his way to the top!","it":"Un normale impiegato, Toru Minasuki, è stato inghiottito da una fessura dimensionale e si è reincarnato in un altro mondo. Dopo la reincarnazione, a Toru viene donata una [skillboard] da Dio. Ne approfitterà per acquisire tutte le abilità necessarie a sopravvivere in questo mondo! Nonostante sia una \"lost person\".","pt-br":"Um trabalhador assalariado normal, Toru Minasuki, foi engolido por uma fenda dimensional e reencarnou em um mundo cheio de vermes e monstros. Após a reencarnação, Toru recebeu um [Quadro de Habilidades] por uma deusa. Aproveite ao máximo para adquirir todas as habilidades necessárias! Mesmo sendo uma \"pessoa inferior\", ele chegará ao topo?","ru":"Обычный офисный работник, Тору Мизунори, был поглощен огромной расщелиной и был перерожден в другом мире. После перерождения Бог дал Тору \"список навыков\". Сделай все возможное, что бы приобрести все нужные навыки! Несмотря на то, что он \"слабейший человек\", он пробьется к вершине.","th":"มิซึโนริ โทรุ คนทำงานสำนักงานทั่วไป ถูกกลืนหายไปกับรอยแยกมิติ แล้วมาเกิดใหม่ที่ต่างโลก เมื่อมาเกิดใหม่ โทรุ ได้รับ [สกิลบอร์ด] โดยพระเจ้า ใช้ประโยชน์จากมันให้ได้มากที่สุด เพื่อรับสกิลที่จำเป็นทั้งหมด! แม้ว่าเขาจะเป็น \"คนต่ำต้อย\" เขาก็จะก้าวไปสู่จุดสูงสุด!"},"links":{"al":"123089","amz":"https://www.amazon.co.jp/gp/product/B091HB4BTF","ap":"rettou-hito-no-maken-tsukai-skill-board-wo-kushishite-saikyou-ni-itaru","bw":"series/280578","ebj":"https://ebookjapan.yahoo.co.jp/books/614128","engtl":"https://kmanga.kodansha.com/title/10022/episode/320215","kt":"rettou-hito-no-maken-tsukai-sukiruboudo-o-kushi-shite-saikyou-ni-itaru","mal":"127780","mu":"169080","nu":"inferior-magic-swordsman-using-the-skill-board-to-become-the-strongest","raw":"https://pocket.shonenmagazine.com/episode/13933686331666634061"},"originalLanguage":"ja","publicationDemographic":"shounen","contentRating":"safe","tags":[{"id":"0bc90acb-ccc1-44ca-a34a-b9f3a73259d0","name":{"en":"Reincarnation"}},{"id":"39730448-9a5f-48a2-85b0-a70db87b1233","name":{"en":"Demons"}},{"id":"423e2eae-a7a2-4a8b-ac03-a8351462d71d","name":{"en":"Romance"}},{"id":"87cc87cd-a395-47af-b27a-93258283bbc6","name":{"en":"Adventure"}},{"id":"a1f53773-c69a-4ce5-8cab-fffcd90b1565","name":{"en":"Magic"}},{"id":"aafb99c1-7f60-43fa-b75f-fc9502ce29c7","name":{"en":"Harem"}},{"id":"ace04997-f6bd-436e-b261-779182193d3d","name":{"en":"Isekai"}},{"id":"b29d6a3d-1569-4e7a-8caf-7557bc92cd5d","name":{"en":"Gore"}},{"id":"b9af3a63-f058-46de-a9a0-e0c13906197a","name":{"en":"Drama"}},{"id":"cdc58593-87dd-415e-bbc0-2ec27bf404cc","name":{"en":"Fantasy"}},{"id":"f4122d1c-3b44-44d0-9936-ff7502c39ad3","name":{"en":"Adaptation"}}]}
7a892279-ff67-4a8c-b58f-2880422198a7:::{"id":"7a892279-ff67-4a8c-b58f-2880422198a7","title":{"en":"Zangyaku Sugiru Isekai demo Suzuki wa Kawaii"},"altTitles":[{"ja":"残虐すぎる異世界でも鈴木は可愛い"},{"zh":"即使在过于残酷的异世界我也很可爱"},{"en":"Even If I Was Reincarnated Into This Cruel World, My Cuteness Will Save Everyone!"},{"en":"Such a Cruel Isekai but Suzuki is a Cutie"}],"lastChapter":"11","availableTranslatedLanguages":["en"],"description":{"en":"Takashi Suzuki is a young man who dreams of a heartwarming slow life in some other world. When he finally gets reincarnated into a different world, he receives the \"unconditional love from all local species\" cheat ability, thinking it will allow him to raise cute animals... But the world ends up being a horrible \"anything-goes\" apocalyptic wasteland reeking of blood, filled with executions, torture, looting, and ruled by the most cruel and brutal demons imaginable?! His only weapon is ultimate, unrivaled cuteness... So he decides to use that to butter the demons up and transform this blood and violence-filled world!"},"links":{"al":"150520","amz":"https://www.amazon.co.jp/dp/B0BTNZBGT5","ap":"zangyaku-sugiru-isekai-demo-suzuki-wa-kawaii","bw":"series/398398","ebj":"https://ebookjapan.yahoo.co.jp/books/746096/","kt":"zangyaku-sugiru-isekai-demo-suzuki-wa-kawaii-2022","mal":"149867","mu":"h3nb74y","nu":"suzuki-is-cute-even-in-a-savage-world","raw":"https://comic-walker.com/contents/detail/KDCW_KS02203227010000_68/"},"originalLanguage":"ja","publicationDemographic":"seinen","contentRating":"suggestive","tags":[{"id":"39730448-9a5f-48a2-85b0-a70db87b1233","name":{"en":"Demons"}},{"id":"4d32cc48-9f00-4cca-9b5a-a839f0764984","name":{"en":"Comedy"}},{"id":"aafb99c1-7f60-43fa-b75f-fc9502ce29c7","name":{"en":"Harem"}},{"id":"ace04997-f6bd-436e-b261-779182193d3d","name":{"en":"Isekai"}},{"id":"b29d6a3d-1569-4e7a-8caf-7557bc92cd5d","name":{"en":"Gore"}},{"id":"cdc58593-87dd-415e-bbc0-2ec27bf404cc","name":{"en":"Fantasy"}},{"id":"f4122d1c-3b44-44d0-9936-ff7502c39ad3","name":{"en":"Adaptation"}}]}
33617205-e96b-4f20-88a6-bc1d75e3557c:::{"id":"33617205-e96b-4f20-88a6-bc1d75e3557c","title":{"en":"Isekai de Dorei ni Narimashitaga Goshujin-sama wa Watashi ni Yokujo Shimasen"},"altTitles":[{"ja-ro":"Isekai de Dorei ni Narimashitaga Goshujinsama Ha Watashi ni Yokujo Shimasen"},{"ja":"異世界で奴隷になりましたがご主人さまは私に欲情しません"},{"en":"I Became a Slave in Another World, But My Husband Does Not Feel Any Lust for Me"},{"en":"I'm a Slave in an Alternate World but My Master Does Not Desire Me"},{"zh-hk":"在異世界變成了奴隸，幸好主人對我毫無性趣"},{"zh":"在异世界变成了奴隶，幸好主人对我毫无性趣"}],"availableTranslatedLanguages":["zh-hk","en"],"description":{"en":"6 years ago, Chika found herself in an unknown world and was promptly forced into a human trafficking ring. She was later bought by the stern-faced Douglas, a famous and powerful knight. At that point, Chika thought she would be sentenced to a life of serving her master's every whims, no matter how perverted… but Douglas can't get it up?!  \n  \nIt seems that in the past, he was captured as a prisoner of war, and an experience with a \"male slave\" (really Chika with short hair) traumatized him to the point of impotence. While Chika is happy to do his chores and be doted on by him, his sexual trauma is a sore point for her. Will she ever be able to completely satisfy him, both as a maid and as a woman?  \n\n\n---","zh-hk":"勤劳的奴隶与她的不举主人"},"links":{"al":"137316","ap":"isekai-de-dorei-ni-narimashita-ga-goshujin-sama-wa-watashi-ni-yokujou-shimasen","mal":"121974","mu":"156703","raw":"https://renta.papy.co.jp/renta/sc/frm/item/150895/"},"originalLanguage":"ja","publicationDemographic":"josei","contentRating":"erotica","tags":[{"id":"423e2eae-a7a2-4a8b-ac03-a8351462d71d","name":{"en":"Romance"}},{"id":"4d32cc48-9f00-4cca-9b5a-a839f0764984","name":{"en":"Comedy"}},{"id":"97893a4c-12af-4dac-b6be-0dffb353568e","name":{"en":"Sexual Violence"}},{"id":"ace04997-f6bd-436e-b261-779182193d3d","name":{"en":"Isekai"}},{"id":"cdc58593-87dd-415e-bbc0-2ec27bf404cc","name":{"en":"Fantasy"}},{"id":"eabc5b4c-6aff-42f3-b657-3e90cbd00b75","name":{"en":"Supernatural"}},{"id":"f4122d1c-3b44-44d0-9936-ff7502c39ad3","name":{"en":"Adaptation"}}]}
d460cec6-552e-4739-909e-c71836dbea89:::{"id":"d460cec6-552e-4739-909e-c71836dbea89","title":{"en":"Ninja Slayer NeoSaitama·in·Flame 忍者殺手 新埼玉炎上"},"altTitles":[{"ru":"Ниндзя Слеер"},{"ja":"ニンジャスレイヤー ネオサイタマ炎上"},{"zh":"忍者杀手 新埼玉炎上"}],"lastChapter":"60","availableTranslatedLanguages":["ru","zh-hk","en"],"relatedIdds":["d1b5c090-2840-47b6-9396-86bf8def31a3","d1b5c090-2840-47b6-9396-86bf8def31a3","d8a00acf-2c05-4cd9-8d58-5e8c7c432f7b","d8a00acf-2c05-4cd9-8d58-5e8c7c432f7b","d8a00acf-2c05-4cd9-8d58-5e8c7c432f7b","fb7c4d5e-3655-4432-93f6-5061a9e03c1b"],"description":{"en":"Ninjas… Ninjas were… merciless demi-gods, ruling Japan with their karate in the age of ninja tranquility. But, some committed a forbidden form of hara-kiri storing their souls at Kinkaku Temple for future resurrection. Their lost history was falsified and concealed and the truth about these ninja was long forgotten. Now, in the future where the universalization of cynbernetic technology and electronic networks are God, suddenly, sinister ninja souls, resurrected from thousands of years past are unleashed on the dark shadows of Neo-Saitama. Fujikido Kenji, is a salaryman whose wife and child were killed in a ninja turf war. In a brush with his own death, Fujikido is possessed by an enigmatic ninja soul. Fujikido cheats death and becomes Ninja Slayer. A Grim Reaper destined to kill evil ninja, committed to a personal war of vengeance. Set in the dystopian underworld of Neo-Saitama, Ninja Slayer takes on Soukai Syndicate ninjas in mortal combat.","ja":"邪悪なニンジャ組織「ソウカイ・シンジケート」の抗争によって妻子を殺されたサラリマン、フジキド・ケンジ。死の淵を彷徨っていた彼もまたニンジャソウル憑依者として蘇り、ソウカイヤに対する復讐の戦いを開始する。","zh":"上班族藤木户·健二的妻儿在邪恶的忍者组织「总会·Syndicate」的抗争中不幸丧生，他自己也深陷死亡深渊的时候被忍者soul凭依而复活，开始了对总会屋的复仇之战。","zh-hk":"上班族藤木戶·健二的妻兒在邪惡的忍者組織「總會·Syndicate」的抗爭中不幸喪生，他自己也深陷死亡深淵的時候被忍者soul憑依而復活，開始了對總會屋的復仇之戰。"},"links":{"al":"87173","amz":"https://www.amazon.co.jp/gp/product/B074C4G2XT","ap":"ninja-slayer","bw":"series/24805","ebj":"https://ebookjapan.yahoo.co.jp/books/209271/","engtl":"https://space.bilibili.com/1365066007","kt":"34666","mal":"86400","mu":"101260","raw":"https://diehardtales.com/"},"originalLanguage":"ja","publicationDemographic":"shounen","contentRating":"suggestive","tags":[{"id":"256c8bd9-4904-4360-bf4f-508a76d67183","name":{"en":"Sci-Fi"}},{"id":"391b0423-d847-456f-aff0-8b0cfc03066b","name":{"en":"Action"}},{"id":"489dd859-9b61-4c37-af75-5b18e88daafc","name":{"en":"Ninja"}},{"id":"4d32cc48-9f00-4cca-9b5a-a839f0764984","name":{"en":"Comedy"}},{"id":"5ca48985-9a9d-4bd8-be29-80dc0303db72","name":{"en":"Crime"}},{"id":"799c202e-7daa-44eb-9cf7-8a3c0441531e","name":{"en":"Martial Arts"}},{"id":"87cc87cd-a395-47af-b27a-93258283bbc6","name":{"en":"Adventure"}},{"id":"97893a4c-12af-4dac-b6be-0dffb353568e","name":{"en":"Sexual Violence"}},{"id":"acc803a4-c95a-4c22-86fc-eb6b582d82a2","name":{"en":"Wuxia"}},{"id":"ace04997-f6bd-436e-b261-779182193d3d","name":{"en":"Isekai"}},{"id":"b29d6a3d-1569-4e7a-8caf-7557bc92cd5d","name":{"en":"Gore"}},{"id":"b9af3a63-f058-46de-a9a0-e0c13906197a","name":{"en":"Drama"}},{"id":"eabc5b4c-6aff-42f3-b657-3e90cbd00b75","name":{"en":"Supernatural"}},{"id":"f4122d1c-3b44-44d0-9936-ff7502c39ad3","name":{"en":"Adaptation"}}]}
5924767b-2288-40c7-8304-0d5879c353b3:::{"id":"5924767b-2288-40c7-8304-0d5879c353b3","title":{"en":"Dragon Yashinatte Kudasai"},"altTitles":[{"ja":"ドラゴン養ってください"},{"ja-ro":"Doragon Yashinatte Kudasai"}],"availableTranslatedLanguages":["en"],"description":{"en":"One day, a college student named Murakami encounters a dragon named Ilsela who came from another world. Ilsela, who aims to be an 'Ichiryumae,' seems to want someone to 'adopt' them while they train in the human world...!?\"\n\nEating, sleeping, and playing with a dragon. A relaxed fantasy in a six-tatami room."},"links":{"al":"170574","mal":"163585","mu":"maftt9l","raw":"https://urasunday.com/title/2529"},"originalLanguage":"ja","publicationDemographic":"seinen","contentRating":"safe","tags":[{"id":"4d32cc48-9f00-4cca-9b5a-a839f0764984","name":{"en":"Comedy"}},{"id":"ace04997-f6bd-436e-b261-779182193d3d","name":{"en":"Isekai"}},{"id":"cdc58593-87dd-415e-bbc0-2ec27bf404cc","name":{"en":"Fantasy"}},{"id":"dd1f77c5-dea9-4e2b-97ae-224af09caf99","name":{"en":"Monster Girls"}},{"id":"e5301a23-ebd9-49dd-a0cb-2add944c7fe9","name":{"en":"Slice of Life"}}]}
617b18d4-30df-459e-b89f-107ed60e83e6:::{"id":"617b18d4-30df-459e-b89f-107ed60e83e6","title":{"en":"Bocchi the Rock! - Burari Tohiko"},"altTitles":[{"en":"Aimless Escapade"},{"ja":"ぶらり逃避行"}],"availableTranslatedLanguages":["en"],"relatedIdds":["2e0fdb3b-632c-4f8f-a311-5b56952db647"],"description":{},"links":{"raw":"https://www.melonbooks.co.jp/detail/detail.php?product_id=2027284"},"originalLanguage":"ja","contentRating":"safe","tags":[{"id":"0234a31e-a729-4e28-9d6a-3f87c4966b9e","name":{"en":"Oneshot"}},{"id":"4d32cc48-9f00-4cca-9b5a-a839f0764984","name":{"en":"Comedy"}},{"id":"b13b2a48-c720-44a9-9c77-39c9979373fb","name":{"en":"Doujinshi"}},{"id":"e5301a23-ebd9-49dd-a0cb-2add944c7fe9","name":{"en":"Slice of Life"}}]}
9f5d9e90-d9bd-45ae-a64a-70491c96816d:::{"id":"9f5d9e90-d9bd-45ae-a64a-70491c96816d","title":{"en":"Alicia Y"},"altTitles":[{"ja":"アリシアY"}],"lastChapter":"13","availableTranslatedLanguages":["en"],"description":{},"links":{"mu":"zt1o0bm"},"originalLanguage":"ja","contentRating":"suggestive","tags":[{"id":"391b0423-d847-456f-aff0-8b0cfc03066b","name":{"en":"Action"}},{"id":"b29d6a3d-1569-4e7a-8caf-7557bc92cd5d","name":{"en":"Gore"}},{"id":"eabc5b4c-6aff-42f3-b657-3e90cbd00b75","name":{"en":"Supernatural"}}]}
dbcee2f0-2ea2-42ea-800d-7942e33840c8:::{"id":"dbcee2f0-2ea2-42ea-800d-7942e33840c8","title":{"en":"It's My Destiny to Be Hero's Savior"},"altTitles":[{"ko":"주인공의 구원자가 될 운명입니다"},{"ko-ro":"Juingong'eui Guwonjaga Doel Unmyeong'ibnida"},{"ko-ro":"Juingongui Guwonjaga Doel Unmyeongimnida"},{"en":"The Hero's Savior"},{"en":"It's My Destiny to Be the Hero's Saviour"},{"en":"I'm Destined to Be the Savior of the Male Lead"},{"en":"Destined to Be the Savior of the Protagonist"},{"uk":"Моя доля — стати рятівницею головного героя"},{"mn":"Гол дүрийн аврагч болох нь миний хувь тавилан"},{"ja":"主人公を救う運命です"},{"zh":"成为主角的命定救星"},{"zh-hk":"我注定成為主角的救星"},{"zh-hk":"注定要成為主人公的救世主"},{"zh-hk":"注定成為主角的救世主"},{"vi":"Vị cứu tinh của nhân vật chính"},{"id":"Takdirku Adalah Menjadi Penyelamat Tokoh Utama"},{"id":"Hidupku Tentram dengan Pai"}],"availableTranslatedLanguages":["pt-br","en","pl"],"description":{"en":"I remember the memory of my previous life when I was abused by my father for the experiment. Then I realized. According to my previous life, this is the world of fantasy fiction I’ve read. That she was born with a minor role and died before the novel even started. Ariadne thought calmly, ‘I am screwed.’\n\nShe was also screwed on a global basis, this novel has a bad ending. The end of this 10-volume Munchkin (overpowered) fantasy novel is it was the failure of the protagonist and the destruction of the world.\n\n---\nAfter years of torture at the hands of her own father, young elementalist Ariadne Eldier sees her chance to escape when her mother’s untimely death prompts a visit from her grandfather, a powerful archmage. Once whisked away to safety, Aria begins her plans to not only distribute an elixir for the contamination plaguing the land, but also save the protagonist and prevent this novel’s tragic ending. But with her own fated death looming, will Aria be able to become the hero this tale needs?\n\n---\n**Original Webtoon:** [Daum](https://webtoon.kakao.com/content/%EC%A3%BC%EC%9D%B8%EA%B3%B5%EC%9D%98-%EA%B5%AC%EC%9B%90%EC%9E%90%EA%B0%80-%EB%90%A0-%EC%9A%B4%EB%AA%85%EC%9E%85%EB%8B%88%EB%8B%A4/2890), [KakaoPage](https://page.kakao.com/content/59494826)\n\n**Official Translations:**\n* [English](https://tapas.io/series/the-heros-savior/info)\n* [Chinese (Simplified) / 汉语](https://pdt.tencentac.com/?adtag=appshare.ios.detail%26QQ%26301\u0026contentId=301) (App only)\n* [Indonesian / Bahasa Indonesia](https://id.kakaowebtoon.com/content/The-Heros-Savior/597)\n* [Japanese / 日本語](https://piccoma.com/web/product/112577)","uk":"У мене в голові виникнули спогади про те, як у минулому житті батько катував мене експериментами. І я зрозуміла, що народилася другорядним персонажем, який помер ще до початку розвитку дій роману жанру “фентезі”, яку прочитала у минулому житті.\nАріадна спокійно подумала. Це провал. Провал трапився ще навіть за облаштування цього світу.\n\"Цей роман. Тут поганий кінець.\"\nКінець цього фентезі роману про чарівну країну з десятьма книгами. З провалом головного героя світ було зруйновано.\nЯкщо головний герой воскресне, поганий кінець забезпечений. Бувають же такі новели!\nЯкщо вона збирається змінити кінець, то повинна врятувати і світ, і головного героя, і його друзів.\nАле людина, яку вона має врятувати насамперед...\n\"Візьми мене з собою, дідусю!\".\nЦе її саму, яка мала б загинути у шістнадцятирічному віці від тортур.\n\n---\n**Original Webtoon:** [Daum](https://webtoon.kakao.com/content/%EC%A3%BC%EC%9D%B8%EA%B3%B5%EC%9D%98-%EA%B5%AC%EC%9B%90%EC%9E%90%EA%B0%80-%EB%90%A0-%EC%9A%B4%EB%AA%85%EC%9E%85%EB%8B%88%EB%8B%A4/2890), [KakaoPage](https://page.kakao.com/content/59494826)\n\n**Official Translations:**\n* [English](https://tapas.io/series/the-heros-savior/info)\n* [Chinese (Simplified) / 汉语](https://pdt.tencentac.com/?adtag=appshare.ios.detail%26QQ%26301\u0026contentId=301) (App only)\n* [Indonesian / Bahasa Indonesia](https://id.kakaowebtoon.com/content/The-Heros-Savior/597)\n* [Japanese / 日本語](https://piccoma.com/web/product/112577)","zh-hk":"她是公爵的孩子，但是母親很有可能是被父親殺害的！要逃出公爵府才能保住自己的性命，可是，她能依靠的……只有那個看起來很冷漠的外公。\n\n---\n**Original Webtoon:** [Daum](https://webtoon.kakao.com/content/%EC%A3%BC%EC%9D%B8%EA%B3%B5%EC%9D%98-%EA%B5%AC%EC%9B%90%EC%9E%90%EA%B0%80-%EB%90%A0-%EC%9A%B4%EB%AA%85%EC%9E%85%EB%8B%88%EB%8B%A4/2890), [KakaoPage](https://page.kakao.com/content/59494826)\n\n**Official Translations:**\n* [English](https://tapas.io/series/the-heros-savior/info)\n* [Chinese (Simplified) / 汉语](https://pdt.tencentac.com/?adtag=appshare.ios.detail%26QQ%26301\u0026contentId=301) (App only)\n* [Indonesian / Bahasa Indonesia](https://id.kakaowebtoon.com/content/The-Heros-Savior/597)\n* [Japanese / 日本語](https://piccoma.com/web/product/112577)"},"links":{"al":"150825","ap":"its-my-destiny-to-be-the-heros-savior","engtl":"https://tapas.io/series/the-heros-savior/info","mal":"151233","mu":"vfcwfde","nu":"it-is-my-destiny-to-be-the-savior-of-the-protagonist","raw":"https://page.kakao.com/home?seriesId=59494826"},"originalLanguage":"ko","publicationDemographic":"shoujo","contentRating":"safe","tags":[{"id":"0bc90acb-ccc1-44ca-a34a-b9f3a73259d0","name":{"en":"Reincarnation"}},{"id":"3e2b8dae-350e-4ab8-a8ce-016e844b9f0d","name":{"en":"Long Strip"}},{"id":"423e2eae-a7a2-4a8b-ac03-a8351462d71d","name":{"en":"Romance"}},{"id":"a1f53773-c69a-4ce5-8cab-fffcd90b1565","name":{"en":"Magic"}},{"id":"ace04997-f6bd-436e-b261-779182193d3d","name":{"en":"Isekai"}},{"id":"cdc58593-87dd-415e-bbc0-2ec27bf404cc","name":{"en":"Fantasy"}},{"id":"e197df38-d0e7-43b5-9b09-2842d0c326dd","name":{"en":"Web Comic"}},{"id":"f4122d1c-3b44-44d0-9936-ff7502c39ad3","name":{"en":"Adaptation"}},{"id":"f5ba408b-0e7a-484d-8d49-4e9125ac96de","name":{"en":"Full Color"}}]}
