53973ca5-32cc-400c-b4f0-8b129fd3cd91:::{"id":"53973ca5-32cc-400c-b4f0-8b129fd3cd91","title":{"en":"A Yandere Girl Who Is Not Very Good at Being Yandere"},"altTitles":[{"ja-ro":"Yandere ga Heta na Yandere Musume"},{"ja":"ヤンデレが下手なヤンデレ娘"},{"it":"Una ragazza yandere che non è molto brava ad essere una yandere"}],"availableTranslatedLanguages":["en","fr","pt-br","id","vi","pl","it","cs"],"description":{},"links":{"al":"164261","kt":"yandere-ga-hetana-yandere-musume","mu":"6outdpw","raw":"https://www.pixiv.net/user/88005027/series/192857"},"originalLanguage":"ja","contentRating":"safe","tags":[{"id":"423e2eae-a7a2-4a8b-ac03-a8351462d71d","name":{"en":"Romance"}},{"id":"4d32cc48-9f00-4cca-9b5a-a839f0764984","name":{"en":"Comedy"}},{"id":"e197df38-d0e7-43b5-9b09-2842d0c326dd","name":{"en":"Web Comic"}}]}
ca3692c0-2abe-4fba-91f4-1c76611539c6:::{"id":"ca3692c0-2abe-4fba-91f4-1c76611539c6","title":{"en":"The Ultimate of All Ages"},"altTitles":[{"en":"The Ancient Sovereign of Eternity"},{"en":"The Eternal Supreme"},{"zh":"万古至尊"},{"en":"Rebirth Of The Ultimate Master"}],"availableTranslatedLanguages":["en"],"description":{"en":"First among the ten martial emperors, Peerless Martial Emperor Gu Fei Yang met his demise in the Tiandang mountains. He was reincarnated fifteen years later, as Li Yun Xiao of the Tianshui Nation, and thus began a heaven-defying battlefront with the countless talents of the current generation. Martial arts of the nine heavens and ten divine realms. From then on, the whole world was set ablaze."},"links":{"al":"138726","mu":"182943","raw":"https://www.kuaikanmanhua.com/web/topic/10698/"},"originalLanguage":"zh","publicationDemographic":"shounen","contentRating":"suggestive","tags":[{"id":"0bc90acb-ccc1-44ca-a34a-b9f3a73259d0","name":{"en":"Reincarnation"}},{"id":"391b0423-d847-456f-aff0-8b0cfc03066b","name":{"en":"Action"}},{"id":"3e2b8dae-350e-4ab8-a8ce-016e844b9f0d","name":{"en":"Long Strip"}},{"id":"799c202e-7daa-44eb-9cf7-8a3c0441531e","name":{"en":"Martial Arts"}},{"id":"87cc87cd-a395-47af-b27a-93258283bbc6","name":{"en":"Adventure"}},{"id":"ace04997-f6bd-436e-b261-779182193d3d","name":{"en":"Isekai"}},{"id":"cdc58593-87dd-415e-bbc0-2ec27bf404cc","name":{"en":"Fantasy"}},{"id":"e197df38-d0e7-43b5-9b09-2842d0c326dd","name":{"en":"Web Comic"}}]}
a19db143-0399-4c72-b999-75544b509cb9:::{"id":"a19db143-0399-4c72-b999-75544b509cb9","title":{"en":"Danshi da to Omotteita Osananajimi to no Shinkon Seikatsu ga Umakuiki sugiru Kudan ni Tsuite"},"altTitles":[{"en":"Regarding of My Married Life With a Childhood Friend Whom I Thought Was a Boy Going Way Too Smoothly"},{"ja":"男子だと思っていた幼馴染との新婚生活がうまくいきすぎる件について"},{"ja-ro":"Danshi dato Omotteita Osanajimi tono Shinkon Seikatsu ga Umaku Ikisugiru ken ni Tsuite"}],"availableTranslatedLanguages":["en","id","vi","pt-br"],"description":{"en":"Shuichi, a high school student, ended up marrying his childhood friend whom he thought was a boy. At their reunion after 10 years, his childhood friend Yuika had transformed into a beautiful girl, which initially made Shuichi quite nervous. However, as time passed, he gradually grew accustomed to the sense of closeness as best friends—\nand thus, their love story as an ideal couple with a charming touch of innocence begins!","pt-br":"Shuichi, um estudante do ensino médio, acabou se casando com seu amigo de infância que ele pensava ser um menino. Em seu reencontro após 10 anos, sua amiga de infância Yuika se transformou em uma linda garota, o que inicialmente deixou Shuichi bastante nervoso. No entanto, com o passar do tempo, ele gradualmente se acostumou com a sensação de proximidade como melhores amigos - e assim começa a história de amor deles como um casal ideal com um toque encantador de inocência!"},"links":{"al":"163482","amz":"https://www.amazon.co.jp/dp/B0CKZ8S4PV","ap":"danshi-da-to-omotte-ita-osananajimi-to-no-shinkon-seikatsu-ga-umaku-ikisugiru-ken-nitsuite","bw":"series/436805","kt":"danshi-da-to-omotte-ita-osananajimi-to-no-shinkon-seikatsu-ga-umaku-ikisugiru-ken-nitsuite-2023","mal":"159873","mu":"xk05ek5","raw":"https://comic-walker.com/contents/detail/KDCW_AM06204126010000_68/"},"originalLanguage":"ja","publicationDemographic":"shounen","contentRating":"safe","tags":[{"id":"423e2eae-a7a2-4a8b-ac03-a8351462d71d","name":{"en":"Romance"}},{"id":"4d32cc48-9f00-4cca-9b5a-a839f0764984","name":{"en":"Comedy"}},{"id":"caaa44eb-cd40-4177-b930-79d3ef2afe87","name":{"en":"School Life"}},{"id":"e5301a23-ebd9-49dd-a0cb-2add944c7fe9","name":{"en":"Slice of Life"}},{"id":"f4122d1c-3b44-44d0-9936-ff7502c39ad3","name":{"en":"Adaptation"}}]}
bcb19cd9-85c6-454c-acb5-90a87b7e2000:::{"id":"bcb19cd9-85c6-454c-acb5-90a87b7e2000","title":{"en":"I Know How to Deal with Hypnosis Apps!"},"altTitles":[{"ja":"催眠アプリの対処法わかった!!!!"}],"availableTranslatedLanguages":["id"],"description":{},"links":{"raw":"https://twitter.com/chimairasuzuki/status/1716054836373078259"},"originalLanguage":"ja","contentRating":"safe","tags":[{"id":"0234a31e-a729-4e28-9d6a-3f87c4966b9e","name":{"en":"Oneshot"}},{"id":"423e2eae-a7a2-4a8b-ac03-a8351462d71d","name":{"en":"Romance"}},{"id":"4d32cc48-9f00-4cca-9b5a-a839f0764984","name":{"en":"Comedy"}},{"id":"e197df38-d0e7-43b5-9b09-2842d0c326dd","name":{"en":"Web Comic"}}]}
d5208b9d-5233-4672-bf5c-6e7d23767e37:::{"id":"d5208b9d-5233-4672-bf5c-6e7d23767e37","title":{"en":"J\u003c-\u003eM"},"altTitles":[{"en":"J and M"}],"availableTranslatedLanguages":["en","pt-br"],"description":{"en":"J is a lone assassin feared as \"untouchable\" in the underworld.\nMegumi is a lonely girl who has no place at home or school.\nWhen the two meet, an unexpected story begins."},"links":{"al":"163827","mal":"162566","mu":"9kqzgar","raw":"https://comic-walker.com/contents/detail/KDCW_EB06204023010000_68/"},"originalLanguage":"ja","publicationDemographic":"seinen","contentRating":"safe","tags":[{"id":"2bd2e8d0-f146-434a-9b51-fc9ff2c5fe6a","name":{"en":"Genderswap"}},{"id":"391b0423-d847-456f-aff0-8b0cfc03066b","name":{"en":"Action"}},{"id":"4d32cc48-9f00-4cca-9b5a-a839f0764984","name":{"en":"Comedy"}},{"id":"caaa44eb-cd40-4177-b930-79d3ef2afe87","name":{"en":"School Life"}}]}
e54c384f-5163-4fdb-9909-968b8d0bd86a:::{"id":"e54c384f-5163-4fdb-9909-968b8d0bd86a","title":{"en":"Kizoku Tensei ~Megumareta Umare kara Saikyou no Chikara wo Eru~"},"altTitles":[{"en":"Noble Reincarnation ~Born Blessed, So I’ll Obtain Ultimate Power~"},{"ja":"貴族転生～恵まれた生まれから最強の力を得る～"},{"zh-hk":"貴族轉生～得天眷顧一出生就獲得最強力量～"}],"availableTranslatedLanguages":["en","fr","es-la","pt-br"],"description":{"en":"Born as the Thirteenth Prince, Noah was originally in a position removed from the imperial succession, so he freely passed his time in the fief granted to him. However, the Crown Prince died before the Emperor. The imperial succession would be fairly contested among the remaining princes. Noah, being the strongest despite living freely, overwhelmed the other princes and eventually became the Emperor with the most power in the world."},"links":{"al":"127165","amz":"https://www.amazon.co.jp/dp/B08KKW2B3X","ap":"kizoku-tensei-megumareta-umare-kara-saikyou-no-chikara-ga-eru","bw":"series/243988","ebj":"https://ebookjapan.yahoo.co.jp/books/585658","engtl":"https://global.manga-up.com/manga/22","kt":"kizoku-tensei-megumareta-umare-kara-saikyou-no-chikara-wo-eru","mal":"131342","mu":"165395","nu":"noble-reincarnationblessed-with-the-strongest-power-from-birth","raw":"https://magazine.jp.square-enix.com/yg/introduction/kizoku/"},"originalLanguage":"ja","publicationDemographic":"seinen","contentRating":"safe","tags":[{"id":"0bc90acb-ccc1-44ca-a34a-b9f3a73259d0","name":{"en":"Reincarnation"}},{"id":"391b0423-d847-456f-aff0-8b0cfc03066b","name":{"en":"Action"}},{"id":"87cc87cd-a395-47af-b27a-93258283bbc6","name":{"en":"Adventure"}},{"id":"a1f53773-c69a-4ce5-8cab-fffcd90b1565","name":{"en":"Magic"}},{"id":"ac72833b-c4e9-4878-b9db-6c8a4a99444a","name":{"en":"Military"}},{"id":"b9af3a63-f058-46de-a9a0-e0c13906197a","name":{"en":"Drama"}},{"id":"cdc58593-87dd-415e-bbc0-2ec27bf404cc","name":{"en":"Fantasy"}},{"id":"f4122d1c-3b44-44d0-9936-ff7502c39ad3","name":{"en":"Adaptation"}}]}
8b008f03-3c12-4c35-a9fc-1b58f9a6e4b2:::{"id":"8b008f03-3c12-4c35-a9fc-1b58f9a6e4b2","title":{"en":"Tokage Bakuhatsu Shiro"},"altTitles":[{"en":"High School Life of Demi-Humans"},{"en":"Lizard Explode"},{"ru":"Школьная жизнь полулюдей"},{"ja":"トカゲ爆発しろ"}],"availableTranslatedLanguages":["es-la","en"],"description":{"en":"Lizardmen are hit by disasters today in a high school, where there are various races such as elves and beasts. But this lizard is quite delicious, and I'm sick of it!"},"links":{"ap":"tokage-bakuhatsu-shiro","mal":"126541","mu":"162101","raw":"https://comic-walker.com/contents/detail/KDCW_MF02201425010000_68/"},"originalLanguage":"ja","contentRating":"safe","tags":[{"id":"423e2eae-a7a2-4a8b-ac03-a8351462d71d","name":{"en":"Romance"}},{"id":"4d32cc48-9f00-4cca-9b5a-a839f0764984","name":{"en":"Comedy"}},{"id":"caaa44eb-cd40-4177-b930-79d3ef2afe87","name":{"en":"School Life"}},{"id":"cdc58593-87dd-415e-bbc0-2ec27bf404cc","name":{"en":"Fantasy"}},{"id":"da2d50ca-3018-4cc0-ac7a-6b7d472a29ea","name":{"en":"Delinquents"}},{"id":"dd1f77c5-dea9-4e2b-97ae-224af09caf99","name":{"en":"Monster Girls"}}]}
d620c533-73ce-40a3-93d8-0d7a96768cc9:::{"id":"d620c533-73ce-40a3-93d8-0d7a96768cc9","title":{"en":"Hayaku Shitai Futari"},"altTitles":[{"en":"Let's do it already."},{"ja":"はやくしたいふたり"},{"zh":"想要更近一步的兩人"}],"lastChapter":"54","availableTranslatedLanguages":["en","es-la","pt-br","vi"],"description":{"en":"Yuuri and Keiichirou fell in love as they shared the same route to neighboring high schools every day. But it turns out Keiichirou comes from a prestigious family where his father and grandfather were both prime ministers. The family rules strictly forbids him from having any inappropriate relations with a woman until he turns 18. Can he resist Yuuri's flirting?  \n\n\n---","vi":"Hasegawa Yuuri, một học sinh cao trung bình thường luôn có ước mơ được “chim chuột” với người yêu. Cô đang hẹn hò với Katsuragi Keiichirou – tương lai sẽ trở thành người đứng đầu đất nước?! Và đặc biệt, trong gia đình của Keiichirou lại có truyền thống kì lạ về chuyện “ấy”? Làm thế nào Yuuri có thể chấp nhận được chuyện này?? Hãy cùng đón xem câu chuyện siêu đáng yêu của cặp đôi chênh lệnh nhất mọi thời đại này nào!!  \n  \n**Links:**  \n- [Author's Twitter](https://twitter.com/aki_kusaka)"},"links":{"al":"120768","amz":"https://www.amazon.co.jp/dp/4088444116/","ap":"hayaku-shitai-futari","bw":"deab12ed3f-f7bd-40fb-bf31-f3e6c46e081d","cdj":"https://www.cdjapan.co.jp/searchuni?q=%E3%81%AF%E3%82%84%E3%81%8F%E3%81%97%E3%81%9F%E3%81%84%E3%81%B5%E3%81%9F%E3%82%8A","ebj":"https://ebookjapan.yahoo.co.jp/books/606198/","kt":"58155","mal":"130155","mu":"167316","raw":"https://www.shueisha.co.jp/books/search/search.html?seriesid=77363"},"originalLanguage":"ja","publicationDemographic":"shoujo","contentRating":"safe","tags":[{"id":"423e2eae-a7a2-4a8b-ac03-a8351462d71d","name":{"en":"Romance"}},{"id":"4d32cc48-9f00-4cca-9b5a-a839f0764984","name":{"en":"Comedy"}},{"id":"caaa44eb-cd40-4177-b930-79d3ef2afe87","name":{"en":"School Life"}},{"id":"fad12b5e-68ba-460e-b933-9ae8318f5b65","name":{"en":"Gyaru"}}]}
65928c4c-9e48-401c-95db-c661abb6f755:::{"id":"65928c4c-9e48-401c-95db-c661abb6f755","title":{"en":"Princess was staring at me"},"altTitles":[{"ja":"王女様に睨まれてると思ったら実は…"},{"vi":"Tưởng công chúa nhìn chằm chằm điều gì, hóa ra là..."}],"availableTranslatedLanguages":["vi","id","en"],"description":{},"links":{"raw":"https://twitter.com/medatarou1/status/1698602531268776334"},"originalLanguage":"ja","contentRating":"safe","tags":[{"id":"0234a31e-a729-4e28-9d6a-3f87c4966b9e","name":{"en":"Oneshot"}},{"id":"423e2eae-a7a2-4a8b-ac03-a8351462d71d","name":{"en":"Romance"}},{"id":"4d32cc48-9f00-4cca-9b5a-a839f0764984","name":{"en":"Comedy"}},{"id":"e197df38-d0e7-43b5-9b09-2842d0c326dd","name":{"en":"Web Comic"}},{"id":"e5301a23-ebd9-49dd-a0cb-2add944c7fe9","name":{"en":"Slice of Life"}}]}
7b7d7198-b53c-40b7-b76b-399a7f41fd20:::{"id":"7b7d7198-b53c-40b7-b76b-399a7f41fd20","title":{"en":"Hanazono-sanchi no Futago-chan"},"altTitles":[{"ja":"花園さんちのふたごちゃん"},{"en":"Oh, Those Hanazono Twins"}],"lastChapter":"73","availableTranslatedLanguages":["en","id","es-la","vi","ru"],"description":{"en":"Tatara Tani is an average high school first year, both in terms of grades and athleticism. He has two childhood friends that attend his school, and they're twins! The elder sister Ranko is a flashy gal, while the younger sister Yuriko is a popular idol. They had slowly become distant from Tatara, but even so he always secretly held a crush for Yuriko. One day, Yuriko suddenly asked him out on a date. This date was the beginning of a secret relationship between the twins and him!","id":"Tatara Tani adalah seorang remaja kelas 1 SMA yang biasa-biasa saja baik dari segi nilai semester maupun kemampuan atletiknya. Dia memiliki 2 teman masa kecil yang satu sekolah dengannya dan juga merupakan saudari kembar! Sang Kakak Ranko adalah gadis gal yang berjiwa bebas, sedangkan adiknya adalah seorang idol terkenal. Mereka perlahan mulai menjauh dari Tatara, tapi meski begitu Tatara selalu memendam perasaan terhadap Yuriko. Suatu hari, Yuriko tiba-tiba mengajaknya pergi berkencan. Kencan inilah yang mengawali terjalinnya hubungan rahasia diantara si kembar dan Tatara!"},"links":{"al":"121766","amz":"https://www.amazon.co.jp/dp/B08VF17FLB","ap":"hanazono-sanchi-no-futago-chan","bw":"series/280583/","ebj":"https://ebookjapan.yahoo.co.jp/books/614122/","engtl":"https://kodansha.us/series/oh-those-hanazono-twins/","kt":"57300","mal":"128328","mu":"170290","raw":"https://pocket.shonenmagazine.com/episode/13933686331677338756"},"originalLanguage":"ja","publicationDemographic":"shounen","contentRating":"safe","tags":[{"id":"423e2eae-a7a2-4a8b-ac03-a8351462d71d","name":{"en":"Romance"}},{"id":"4d32cc48-9f00-4cca-9b5a-a839f0764984","name":{"en":"Comedy"}},{"id":"caaa44eb-cd40-4177-b930-79d3ef2afe87","name":{"en":"School Life"}},{"id":"e5301a23-ebd9-49dd-a0cb-2add944c7fe9","name":{"en":"Slice of Life"}},{"id":"f42fbf9e-188a-447b-9fdc-f19dc1e4d685","name":{"en":"Music"}},{"id":"fad12b5e-68ba-460e-b933-9ae8318f5b65","name":{"en":"Gyaru"}}]}
aa6c76f7-5f5f-46b6-a800-911145f81b9b:::{"id":"aa6c76f7-5f5f-46b6-a800-911145f81b9b","title":{"en":"Sono Bisque Doll wa Koi wo Suru"},"altTitles":[{"de":"More than a Doll"},{"fr":"Sexy Cosplay Doll"},{"en":"My Dress-Up Darling"},{"ru":"Эта фарфоровая кукла влюбилась"},{"ja":"その着せ替え人形は恋をする"},{"zh":"更衣人偶墜入愛河"},{"ko":"그 장난감 인형은 사랑을 한다"},{"es-la":"Esa muñeca de porcelana está enamorada"},{"ne":"ड्रेस-अप पुतली प्रेममा पर्छ"},{"ar":"ماي دريس-أب دارلينغ"},{"zh-hk":"戀上換裝娃娃"},{"th":"หนุ่มเย็บผ้ากับสาวนักคอสเพลย์"},{"hi":"എന്റെ വസ്ത്രധാരണം പ്രിയേ"},{"pl":"Projekt Cosplay"},{"ja-ro":"Sono Kisekae Ningyou wa Koi wo Suru"},{"vi":"Cô Nàng Nổi Loạn X Chàng Thợ May"},{"vi":"Nàng Búp Bê Thử Đồ Của Tôi Biết Yêu"},{"pt-br":"Minha Adorável Cosplayer"},{"uk":"Ця порцелянова лялечка закохалася"},{"en":"The Bisque doll is falling in love"}],"availableTranslatedLanguages":["en","pt-br","id","vi","ru","fa","fr","tr","hu","uk","it","es-la"],"relatedIdds":["327c6084-bad9-4a04-9db8-b5a07a7c9988","3895c651-c45e-431d-953e-0490f4048bee","455b533c-76d8-4cd2-822e-4fd08064c382","483877b3-d301-40f3-94a2-82e2ca0daa64","842fe7b3-aad1-4c24-aea8-c885c2b3763f","89952dbc-bdda-433c-8611-a484c9ff8df6","8af2042c-fc5a-4180-a270-819e9ea1707e","8dbbf7b2-6e49-4bf1-a0f8-50b43af72f3f","96724e36-aa77-4cf9-ac46-5947d7a9639c","9c1ff711-fd24-49d3-b1ae-4f1a9ee4ad7d","cad9b0e5-a318-4c69-8097-cb81c5f3a57b","f6923bf3-5d92-4544-83e1-21b32b5610cb","f6ded04e-1799-4ee6-87dd-16d81ea9efed","fa27edc5-b7d9-4b22-827c-93185e810f42","ffbfa849-af5b-49f9-b026-cb8f685476b5"],"description":{"en":"Wakana Gojou is a fifteen year old high-school boy who was socially traumatized in the past due to his passions. That incident left a mark on him that made him into a social recluse. Until one day he had an encounter with Kitagawa who is a sociable gyaru, who is the complete opposite of him. They soon share their passions with one another which leads to their odd relationship.","es-la":"Wakana Gojou es un joven de quince años de edad que se vio traumatizado socialmente en el pasado debido a sus pasiones. Ese incidente le dejó una marca que lo convirtió en un recluso social. Hasta que un día tuvo un encuentro con Kitagawa, una gyaru sociable, que es todo lo contrario a él. Pronto comparten sus pasiones entre sí, lo que da lugar a su extraña relación.","pt-br":"Wakana Gojou é um garoto de quinze anos que foi socialmente traumatizado no passado devido a suas paixões. Aquele incidente deixou uma marca nele que o fez ser um recluso social. Até que um dia ele teve um encontro com Kitagawa, que é um gyaru sociável, que é o completo oposto dele. Eles logo compartilham suas paixões uns com os outros, o que leva a um relacionamento estranho.","tr":"Wakana Gojou, vadesi geçmiş tutkuları nedeniyle toplumsal travmaları olan 15 yaşında bir liselidir. Bu olayın bıraktığı iz onu toplumdan uzak biri haline getirdi. Bir gün kendisinin tam zıttı, arkadaş canlısı bir gal olan Kitagawa ile karşılaşır. Kısa zamanda garip ilişkilerini yönlendiren tutkularını paylaşırlar.","uk":"Вакана Ґоджьо — п’ятнадцятилітній учень старшої школи, в минулому отримав серйозну психологічну травму на фоні свого захоплення. Внаслідок чого хлопець ізолював себе від соціуму і почав вести затворницький образ життя.\nТак було би і на далі, але в життя Ґоджьо буквально увірвалась Кітаґава — дружелюбна і комунікабельна дівчина, повна його протилежність. Досить швидко вони розділили хоббі один одного, що і привело до їх досить дивних, але міцних відносин.","vi":"Wakana Gojou 15 tuổi là 1 học sinh cao trung từng bị tổn thương tâm lý trong quá khứ do sở thích kỳ lạ của mình. Chuyện đó đã khiến cậu trở nên nhút nhát, rụt rè. Cho tới ngày nọ Gojou tình cờ gặp Kitagawa – một Gyaru – người có tính cách trái ngược hoàn toàn với cậu ấy. 2 người họ hóa ra đều có những điểm chung và đã tạo thành một mối quan hệ hài hước"},"links":{"al":"101583","amz":"https://www.amazon.co.jp/dp/B07L1BZQPL","ap":"sono-bisque-doll-wa-koi-wo-suru","bw":"series/181406","cdj":"https://www.cdjapan.co.jp/product/NEOBK-2283733","ebj":"https://ebookjapan.yahoo.co.jp/books/511186/","engtl":"https://squareenixmangaandbooks.square-enix-games.com/en-us/series/my-dress-up-darling","kt":"41006","mal":"112268","mu":"146700","raw":"https://magazine.jp.square-enix.com/yg/introduction/sonobisque"},"originalLanguage":"ja","publicationDemographic":"seinen","contentRating":"suggestive","tags":[{"id":"423e2eae-a7a2-4a8b-ac03-a8351462d71d","name":{"en":"Romance"}},{"id":"4d32cc48-9f00-4cca-9b5a-a839f0764984","name":{"en":"Comedy"}},{"id":"9ab53f92-3eed-4e9b-903a-917c86035ee3","name":{"en":"Crossdressing"}},{"id":"caaa44eb-cd40-4177-b930-79d3ef2afe87","name":{"en":"School Life"}},{"id":"e5301a23-ebd9-49dd-a0cb-2add944c7fe9","name":{"en":"Slice of Life"}},{"id":"fad12b5e-68ba-460e-b933-9ae8318f5b65","name":{"en":"Gyaru"}}]}
45d3ebca-8d74-4e51-be90-8582e4756cbd:::{"id":"45d3ebca-8d74-4e51-be90-8582e4756cbd","title":{"en":"Dungeon Tou de Yadoya wo Yarou! Souzou Mahou wo Moratta Ore no Hosoude Hanjouki"},"altTitles":[{"ja":"ダンジョン島で宿屋をやろう! 創造魔法を貰った俺の細腕繁盛記"},{"en":"Let's run an inn on Dungeon Island!"},{"zh-hk":"在迷宮島上經營旅館吧！得到創造魔法之後我的成長記"},{"ja-ro":"Dungeon Shima de Yadoya o Yarou! Sōzō Mahō o Moratta Ore no Hosoude Hanjō-ki"},{"zh":"在迷宫岛上经营旅馆吧！得到创造魔法之后我的成长记"},{"ko":"던전 섬에서 여관을 하자! 창조 마법을 받은 나의 가냘픈 번성기"}],"availableTranslatedLanguages":["en","fr","id"],"description":{"en":"One day, Sanada Shirou, who works for a black company, is transported to another world. Using his \"creation magic\", an ability he gained when transported, he opens an inn and is supposed to lead a slow life, but this other world is a little strange?! It is a world where women are overwhelmingly dominant, where women do dangerous work and battle, and men are powerless and are protected! The daily life of entertaining (in many ways) the women of this other world begins...!\n\n---\n**Links:**\n- [Web Novel](https://kakuyomu.jp/works/1177354055503576578)  (JP)"},"links":{"al":"148026","amz":"https://www.amazon.co.jp/dp/B09NZRL3B7","ap":"dungeon-tou-de-yadoya-wo-yarou-souzou-mahou-wo-moratta-ore-no-hosoude-hanjouki","bw":"series/307159","cdj":"https://www.cdjapan.co.jp/product/NEOBK-2615173","ebj":"https://ebookjapan.yahoo.co.jp/books/644122/","kt":"dungeon-tou-de-yadoya-wo-yarou-souzou-mahou-wo-moratta-ore-no-hosoude-hanjouki","mal":"146186","mu":"176602","nu":"lets-start-an-inn-on-the-dungeon-island","raw":"https://pocket.shonenmagazine.com/episode/3269754496476568443"},"originalLanguage":"ja","publicationDemographic":"shounen","contentRating":"erotica","tags":[{"id":"423e2eae-a7a2-4a8b-ac03-a8351462d71d","name":{"en":"Romance"}},{"id":"4d32cc48-9f00-4cca-9b5a-a839f0764984","name":{"en":"Comedy"}},{"id":"87cc87cd-a395-47af-b27a-93258283bbc6","name":{"en":"Adventure"}},{"id":"97893a4c-12af-4dac-b6be-0dffb353568e","name":{"en":"Sexual Violence"}},{"id":"a1f53773-c69a-4ce5-8cab-fffcd90b1565","name":{"en":"Magic"}},{"id":"aafb99c1-7f60-43fa-b75f-fc9502ce29c7","name":{"en":"Harem"}},{"id":"ace04997-f6bd-436e-b261-779182193d3d","name":{"en":"Isekai"}},{"id":"cdc58593-87dd-415e-bbc0-2ec27bf404cc","name":{"en":"Fantasy"}},{"id":"f4122d1c-3b44-44d0-9936-ff7502c39ad3","name":{"en":"Adaptation"}}]}
478feb7a-efa3-4912-8faf-18d287f33cab:::{"id":"478feb7a-efa3-4912-8faf-18d287f33cab","title":{"en":"Yankee-kun to Hakujou Gaaru"},"altTitles":[{"ja":"ヤンキー君と白杖ガール"},{"ja-ro":"Yan-Garu"},{"en":"Love's in Sight!"},{"en":"Yankee-kun and the White Cane Girl"},{"en":"Delinquent and the White Cane Girl"},{"fr":"Yankee-kun et la fille de la canne blanche"},{"pt":"Yankee-kun e a garota da bengala branca"},{"pt-br":"Yankee-kun y la niña de bastón blanco"},{"es":"Delincuente y la niña de bastón blanco"},{"ru":"Хулиган и девушка с белой тростью"}],"lastChapter":"125","availableTranslatedLanguages":["en","pt-br","fr","ru","id","es-la","es"],"description":{"en":"An infamous delinquent, Kurokawa Morio, meets a partially blind girl, Akaza Yukiko.","es":"Un delincuente infame, Kurokawa Morio, se enamora de una muchacha parcialmente ciega llamada Akaza Yukiko.","pt":"O delinquente infame e amplamente temido, Kurokawa Morio, se apaixona por uma garota quase cega chamada Akaza Yukiko. Ela concorda em ir a um encontro com ele, mas será que essa hitória vai terminar bem?","pt-br":"Morio, o Pantera Negra, é um ianque que venceu mais de cem lutas. Ele é amado por seus capangas e temido pelo público. Mas agora, ele enfrenta seu maior desafio quando conhece Yukiko, uma garota parcialmente cega... onde ele se apaixona à primeira vista! \n\nPode Morio superar suas raízes delinquentes e virar uma nova página para seu amor inesperado?"},"links":{"al":"107445","amz":"https://www.amazon.co.jp/dp/B07MSBK5BZ","ap":"yankee-kun-to-hakujou-girl","bw":"series/189409","cdj":"https://www.cdjapan.co.jp/product/NEOBK-2307188","ebj":"https://ebookjapan.yahoo.co.jp/books/521992","engtl":"https://www.viz.com/love-s-in-sight","kt":"54966","mal":"118712","mu":"152616","raw":"https://seiga.nicovideo.jp/comic/35374"},"originalLanguage":"ja","contentRating":"safe","tags":[{"id":"423e2eae-a7a2-4a8b-ac03-a8351462d71d","name":{"en":"Romance"}},{"id":"4d32cc48-9f00-4cca-9b5a-a839f0764984","name":{"en":"Comedy"}},{"id":"b11fda93-8f1d-4bef-b2ed-8803d3733170","name":{"en":"4-Koma"}},{"id":"b9af3a63-f058-46de-a9a0-e0c13906197a","name":{"en":"Drama"}},{"id":"da2d50ca-3018-4cc0-ac7a-6b7d472a29ea","name":{"en":"Delinquents"}},{"id":"e5301a23-ebd9-49dd-a0cb-2add944c7fe9","name":{"en":"Slice of Life"}}]}
