53973ca5-32cc-400c-b4f0-8b129fd3cd91:::{"id":"53973ca5-32cc-400c-b4f0-8b129fd3cd91","title":{"en":"A Yandere Girl Who Is Not Very Good at Being Yandere"},"altTitles":[{"ja-ro":"Yandere ga Heta na Yandere Musume"},{"ja":"ヤンデレが下手なヤンデレ娘"},{"it":"Una ragazza yandere che non è molto brava ad essere una yandere"}],"availableTranslatedLanguages":["en","fr","pt-br","id","vi","pl","it","cs"],"description":{},"links":{"al":"164261","kt":"yandere-ga-hetana-yandere-musume","mu":"6outdpw","raw":"https://www.pixiv.net/user/88005027/series/192857"},"originalLanguage":"ja","contentRating":"safe","tags":[{"id":"423e2eae-a7a2-4a8b-ac03-a8351462d71d","name":{"en":"Romance"}},{"id":"4d32cc48-9f00-4cca-9b5a-a839f0764984","name":{"en":"Comedy"}},{"id":"e197df38-d0e7-43b5-9b09-2842d0c326dd","name":{"en":"Web Comic"}}]}
d4b74b3a-6be3-4916-bc9c-ad2158f23dd0:::{"id":"d4b74b3a-6be3-4916-bc9c-ad2158f23dd0","title":{"en":"Wortenia Senki"},"altTitles":[{"en":"Record of Wortenia War"},{"en":"Wortenia War"},{"ru":"Военные хроники Вортении"},{"ja":"ウォルテニア戦記"},{"zh":"沃特尼亚战记"},{"ko":"워르테니아 전기"}],"availableTranslatedLanguages":["en","ru","pt-br","pl","fr","es-la","id"],"description":{"en":"High school student Mikoshiba Ryouma was summoned to a different world in the middle of a war. Sensing the malice from the one who summoned him (a summoner of the O'ltormea empire), he uses his martial arts to run away, killing important people of the empire during his escape. After the escape, he rescues two twin sisters from the hands of thieves. The sisters who can use magic, swear to serve him as subordinates. Thus, Ryouma begins his journey on the path of the supreme ruler."},"links":{"al":"98822","amz":"https://www.amazon.co.jp/gp/product/B078MKCTHD","ap":"record-of-wortenia-war","bw":"series/112158","ebj":"https://ebookjapan.yahoo.co.jp/books/405593","engtl":"https://j-novel.club/s/record-of-wortenia-war-manga/","kt":"39081","mal":"105962","mu":"140719","nu":"wortenia-senki","raw":"https://firecross.jp/comic/series/232"},"originalLanguage":"ja","publicationDemographic":"shounen","contentRating":"safe","tags":[{"id":"391b0423-d847-456f-aff0-8b0cfc03066b","name":{"en":"Action"}},{"id":"799c202e-7daa-44eb-9cf7-8a3c0441531e","name":{"en":"Martial Arts"}},{"id":"87cc87cd-a395-47af-b27a-93258283bbc6","name":{"en":"Adventure"}},{"id":"a1f53773-c69a-4ce5-8cab-fffcd90b1565","name":{"en":"Magic"}},{"id":"aafb99c1-7f60-43fa-b75f-fc9502ce29c7","name":{"en":"Harem"}},{"id":"ac72833b-c4e9-4878-b9db-6c8a4a99444a","name":{"en":"Military"}},{"id":"ace04997-f6bd-436e-b261-779182193d3d","name":{"en":"Isekai"}},{"id":"b9af3a63-f058-46de-a9a0-e0c13906197a","name":{"en":"Drama"}},{"id":"cdc58593-87dd-415e-bbc0-2ec27bf404cc","name":{"en":"Fantasy"}},{"id":"f4122d1c-3b44-44d0-9936-ff7502c39ad3","name":{"en":"Adaptation"}}]}
0fe937a5-d40c-48d7-bce7-a51000843a5b:::{"id":"0fe937a5-d40c-48d7-bce7-a51000843a5b","title":{"en":"Shinka Tokusei de Saikyou Necromancer"},"altTitles":[{"ja":"進化特性で最強ネクロマンサー"},{"en":"The Strongest Necromancer With Evolutionary Characteristics"},{"en":"Necromancer's Evolutionary Traits"},{"ko":"진화 특성으로 최강 네크로맨서"}],"description":{"en":"Makoto Kaneshiro, a former member of the Special Forces, had been spending his days engrossed in video games while struggling to find his place back into society.\n\nSuddenly, he receives an unexpected phone call. \"Makoto Kaneshiro, is that you?\" The caller possesses detailed knowledge of Makoto's personal information and gaming habits.\n\nCaught off guard, Makoto attempts to shut down his computer, but… to his dismay, he discovers the same situation repeating itself, again and again."},"links":{"ap":"shinka-tokusei-de-saikyou-necromancer","mu":"3azmw46","raw":"https://piccoma.com/web/product/142261"},"originalLanguage":"ja","contentRating":"safe","tags":[{"id":"0bc90acb-ccc1-44ca-a34a-b9f3a73259d0","name":{"en":"Reincarnation"}},{"id":"36fd93ea-e8b8-445e-b836-358f02b3d33d","name":{"en":"Monsters"}},{"id":"391b0423-d847-456f-aff0-8b0cfc03066b","name":{"en":"Action"}},{"id":"3e2b8dae-350e-4ab8-a8ce-016e844b9f0d","name":{"en":"Long Strip"}},{"id":"87cc87cd-a395-47af-b27a-93258283bbc6","name":{"en":"Adventure"}},{"id":"a1f53773-c69a-4ce5-8cab-fffcd90b1565","name":{"en":"Magic"}},{"id":"ace04997-f6bd-436e-b261-779182193d3d","name":{"en":"Isekai"}},{"id":"cdc58593-87dd-415e-bbc0-2ec27bf404cc","name":{"en":"Fantasy"}},{"id":"f4122d1c-3b44-44d0-9936-ff7502c39ad3","name":{"en":"Adaptation"}},{"id":"f5ba408b-0e7a-484d-8d49-4e9125ac96de","name":{"en":"Full Color"}}]}
76a4686c-5805-4161-b1d0-dbf19cffd2e7:::{"id":"76a4686c-5805-4161-b1d0-dbf19cffd2e7","title":{"en":"Iincho to Furyou-kun"},"altTitles":[{"ja":"いいんちょと不良くん"},{"zh":"委員長和不良少年"},{"ru":"Хулиган и староста"}],"lastChapter":"30","availableTranslatedLanguages":["ru","pt-br","en"],"description":{"en":"Contrary to her appearance, Hatsuse Sakura is an idiot. Because of her, \"honor student looks,\" she is appointed as the class president. To meet up to everyone's expectations, Sakura tries her hardest, however, for some reason since then Shinokura, who is rumored to be a delinquent, has been starting to approach her? The romance of two awkward people.","es-la":"Contrariamente a su apariencia, Hatsuse Sakura es una idiota. Debido a su \"aspecto de estudiante de honor\", es nombrada presidenta de la clase. Para cumplir con las expectativas de todos, Sakura se esfuerza al máximo, sin embargo, por alguna razón desde entonces Shinokura, de quien se rumorea que es un delincuente, comienza a acercarse a ella... El romance de dos personas incómodas.","pt-br":"Ao contrário de sua aparência, Hatsuse Sakura é uma idiota. Por causa dela, \"aparência de estudante de honra\", ela é nomeada presidente da classe. Para atender às expectativas de todos, Sakura se esforça ao máximo, no entanto, por algum motivo, desde então, Shinokura, que há rumores de ser um delinquente, começou a se aproximar dela? O romance de duas pessoas estranhas."},"links":{"al":"128064","amz":"https://www.amazon.co.jp/dp/B083K2X4K9","ap":"iincho-to-furyou-kun","bw":"series/233720","cdj":"https://www.cdjapan.co.jp/product/NEOBK-2438683","ebj":"https://ebookjapan.yahoo.co.jp/books/574501/","kt":"iincho-to-furyou-kun","mal":"147425","mu":"il0jc00","raw":"https://comic.pixiv.net/works/6239"},"originalLanguage":"ja","publicationDemographic":"shoujo","contentRating":"safe","tags":[{"id":"423e2eae-a7a2-4a8b-ac03-a8351462d71d","name":{"en":"Romance"}},{"id":"4d32cc48-9f00-4cca-9b5a-a839f0764984","name":{"en":"Comedy"}},{"id":"caaa44eb-cd40-4177-b930-79d3ef2afe87","name":{"en":"School Life"}},{"id":"da2d50ca-3018-4cc0-ac7a-6b7d472a29ea","name":{"en":"Delinquents"}},{"id":"e5301a23-ebd9-49dd-a0cb-2add944c7fe9","name":{"en":"Slice of Life"}}]}
edf40435-a8e4-44d8-ba62-b99138cc83f5:::{"id":"edf40435-a8e4-44d8-ba62-b99138cc83f5","title":{"en":"Kouiu no Gaii"},"altTitles":[{"en":"It is good as it is"},{"ja-ro":"Kou iu no ga ii"},{"en":"This Is Good"},{"ja":"こういうのがいい"}],"availableTranslatedLanguages":["pt-br","en"],"relatedIdds":["051ce60f-bf16-432a-89a5-a8d52bd16de6","0e372504-2af6-4699-8abc-8eba9c9cce1e"],"description":{"en":"Do what we want, when we want, with the person we want. Such a relationship needs no label."},"links":{"al":"117066","kt":"57794","mal":"125807","mu":"flmouqp","raw":"https://ynjn.jp/title/1119"},"originalLanguage":"ja","publicationDemographic":"seinen","contentRating":"suggestive","tags":[{"id":"0234a31e-a729-4e28-9d6a-3f87c4966b9e","name":{"en":"Oneshot"}},{"id":"e5301a23-ebd9-49dd-a0cb-2add944c7fe9","name":{"en":"Slice of Life"}}]}
69a8b34e-8c44-42f1-bf70-2e36e3be5580:::{"id":"69a8b34e-8c44-42f1-bf70-2e36e3be5580","title":{"en":"Finding Meaning"},"description":{"en":"Yuzu, a girl found in a dumpster who has lost all purpose, William, a man who wants to help but doesn’t realize what he’s getting into. Together they face a dark underworld that will stop at nothing to get what they want. Will they be able to succeed in finding meaning? Or will they perish in the darkness? Updates monthly on the last Saturday of each month."},"links":{"engtl":"https://namicomi.com/en/title/jPtXuE4t/finding-meaning?utm_source=md"},"originalLanguage":"en","contentRating":"safe","tags":[{"id":"391b0423-d847-456f-aff0-8b0cfc03066b","name":{"en":"Action"}},{"id":"4d32cc48-9f00-4cca-9b5a-a839f0764984","name":{"en":"Comedy"}},{"id":"5ca48985-9a9d-4bd8-be29-80dc0303db72","name":{"en":"Crime"}},{"id":"891cf039-b895-47f0-9229-bef4c96eccd4","name":{"en":"Self-Published"}},{"id":"cdc58593-87dd-415e-bbc0-2ec27bf404cc","name":{"en":"Fantasy"}},{"id":"eabc5b4c-6aff-42f3-b657-3e90cbd00b75","name":{"en":"Supernatural"}}]}
4088c3cc-6be2-4fb6-80b5-8d8606f00196:::{"id":"4088c3cc-6be2-4fb6-80b5-8d8606f00196","title":{"en":"Shinka no Mi: Shiranai Uchi ni Kachigumi Jinsei"},"altTitles":[{"ja-ro":"Shinka no Mi: Shiranai Uchi ni Kachigumi Jinsei"},{"en":"The Seed of Evolution: Before I knew it I was one of the champions"},{"ru":"Плод эволюции"},{"ja":"進化の実～知らないうちに勝ち組人生～"},{"en":"The Evolution Fruit: Before I Knew it, My Life Had It Made!"},{"en":"The Fruit of Evolution: Before I Knew It, My Life Had It Made"},{"ja-ro":"Shinka no Mi"},{"zh":"进化之实踏上胜利的人生"},{"zh-hk":"進化之實踏上勝利的人生"},{"zh-ro":"Jìnhuà zhī shí tà shàng shènglì de rénshēng"}],"availableTranslatedLanguages":["pt-br","ru","en","it","es-la"],"description":{"en":"Hiiragi Seiichi is an ugly, revolting, dirty, smelly fatass; these are the insults hurled at him one after another about his appearance. Such was Seiichi's daily school life of bullying, then for some reason, one day when school was out, a voice claiming to be a God said over the PA system to prepare to be transported to another world. What's more, not Seiichi alone, but the entire school. A fantasy world where game-like elements such as as levels, stats, and skills exist. However, the God still had preparations to complete for the transfer, and would send them over as soon as the hero summoning ritual was ready. The classes all formed groups to wait for the transfer, but Seiichi alone was left out and as such was summoned to a different area. After being transported the first thing Seiichi ate was the \"Fruit of Evolution.\" This would come to greatly change his life…  \n  \nThis story is about how Seiichi went from being severely bullied by his classmates, even not being recognized for his accomplishments, and despite all that staying positive and surviving in this new world. As a result, he somehow becomes one of the champions. (Also the first heroine is a Gorilla?!)","ru":"Хираги Сэйити – уродливый, отвратительный толстяк. Каждый день в школе над Сэйити издевались из-за его внешности, но в один прекрасный день, когда уроки в школе закончились, из динамика раздался голос Бога, который сказал, чтобы все в школе подготовились к перемещению в другой мир. Фантастический мир, где существуют вещи как в играх, вроде уровней, характеристик, навыков. Все классы поделились на группы и ждали перемещения в другой мир, но так как Сэйити был одиночкой, его переместили в другое место. После перемещения первой едой Сэйити оказался «Плод эволюции», существенно изменивший его жизнь.   \nThe raws of this manga updates once in approximately 3 months  \n  \n**Links**:* [Author's Twitter](https://twitter.com/aoimiku0505)\n* [Original Web Novel](https://ncode.syosetu.com/n4054by/) (Raw)"},"links":{"al":"102150","amz":"https://www.amazon.co.jp/dp/B079VKHQ4L/","ap":"shinka-no-mi","bw":"series/152447/list","cdj":"http://www.cdjapan.co.jp/product/NEOBK-2186417","ebj":"https://ebookjapan.yahoo.co.jp/books/469842/","kt":"41157","mal":"110232","mu":"147435","nu":"shinka-no-mi","raw":"http://seiga.nicovideo.jp/comic/34133"},"originalLanguage":"ja","publicationDemographic":"shounen","contentRating":"suggestive","tags":[{"id":"423e2eae-a7a2-4a8b-ac03-a8351462d71d","name":{"en":"Romance"}},{"id":"4d32cc48-9f00-4cca-9b5a-a839f0764984","name":{"en":"Comedy"}},{"id":"87cc87cd-a395-47af-b27a-93258283bbc6","name":{"en":"Adventure"}},{"id":"a1f53773-c69a-4ce5-8cab-fffcd90b1565","name":{"en":"Magic"}},{"id":"aafb99c1-7f60-43fa-b75f-fc9502ce29c7","name":{"en":"Harem"}},{"id":"ace04997-f6bd-436e-b261-779182193d3d","name":{"en":"Isekai"}},{"id":"b9af3a63-f058-46de-a9a0-e0c13906197a","name":{"en":"Drama"}},{"id":"cdc58593-87dd-415e-bbc0-2ec27bf404cc","name":{"en":"Fantasy"}},{"id":"f4122d1c-3b44-44d0-9936-ff7502c39ad3","name":{"en":"Adaptation"}}]}
3a9a475f-5051-4e2b-ba4d-10ff9ed4e3e1:::{"id":"3a9a475f-5051-4e2b-ba4d-10ff9ed4e3e1","title":{"en":"Nokori Ichinichi de Hametsu Flag Zenbu Heshiorimasu: Zamaa RTA Kiroku 24Hr"},"altTitles":[{"en":"With One Day Left I'll Break All the Destruction Flags: \"Serves You Right!\" RTA 24 Hour Record"},{"ja":"残り一日で破滅フラグ全部へし折ります: ざまぁRTA記録24Hr"},{"en":"Only One Day Remaining to Break All My Destruction Flags: 24 Hour Just Deserts Speedrun"}],"lastChapter":"16.5","availableTranslatedLanguages":["en","es-la"],"description":{"en":"Alexandra is the duchess of the Kingdom of Tarraconensis. It was only the day before the absolution event that she realized that she was the villainous daughter of an otome game! It's clear that she'll be denounced and her engagement will be broken tomorrow.\nBut I don't want to be condemned honestly! I'd rather show my eyes to the people who despised me! With only 24 hours left, Alexandra begins to make a breakthrough in her desperate situation."},"links":{"al":"155855","amz":"https://www.amazon.co.jp/dp/B0BM3XHS3Z","ap":"nokori-ichinichi-de-hametsu-flag-zenbu-heshiorimasu-zamaa-rta-kiroku-24hr","bw":"series/360488","cdj":"https://www.cdjapan.co.jp/searchuni?fq.category=UD%3A14\u0026q=%E6%AE%8B%E3%82%8A%E4%B8%80%E6%97%A5%E3%81%A7%E7%A0%B4%E6%BB%85%E3%83%95%E3%83%A9%E3%82%B0%E5%85%A8%E9%83%A8%E3%81%B8%E3%81%97%E6%8A%98%E3%82%8A%E3%81%BE%E3%81%99%3A+%E3%81%96%E3%81%BE%E3%81%81RTA%E8%A8%98%E9%8C%B224Hr.\u0026order=reldesc","ebj":"https://ebookjapan.yahoo.co.jp/books/704358/","kt":"nokori-ichinichi-de-hametsu-flag-zenbu-heshiorimasu-zamaa-rta-kiroku-24hr","mal":"155065","mu":"vrueylg","raw":"https://comic-walker.com/contents/detail/KDCW_FL00202737010000_68/"},"originalLanguage":"ja","publicationDemographic":"shoujo","contentRating":"safe","tags":[{"id":"423e2eae-a7a2-4a8b-ac03-a8351462d71d","name":{"en":"Romance"}},{"id":"65761a2a-415e-47f3-bef2-a9dababba7a6","name":{"en":"Reverse Harem"}},{"id":"ace04997-f6bd-436e-b261-779182193d3d","name":{"en":"Isekai"}},{"id":"cdc58593-87dd-415e-bbc0-2ec27bf404cc","name":{"en":"Fantasy"}},{"id":"d14322ac-4d6f-4e9b-afd9-629d5f4d8a41","name":{"en":"Villainess"}},{"id":"f4122d1c-3b44-44d0-9936-ff7502c39ad3","name":{"en":"Adaptation"}}]}
a795cee1-18e5-4ec3-ac2a-9675128d6afd:::{"id":"a795cee1-18e5-4ec3-ac2a-9675128d6afd","title":{"en":"Outaishi-sama, Watashi Kondo Koso Anata ni Korosaretakunain desu!"},"altTitles":[{"ja":"王太子様、私今度こそあなたに殺されたくないんです〜聖女に嵌められた貧乏令嬢、二度目は串刺し回避します！〜"},{"en":"You Won't Kill Me This Time, Crown Prince!"},{"zh-hk":"王太子大人，这次我绝不想被你杀掉！"}],"availableTranslatedLanguages":["en"],"description":{"en":"The poverty-stricken noblewoman, Liesel, was murdered by her lover, the crown prince, in an elaborate ruse set up by the evil saintess. However, she receives a second chance to live as she suddenly wakes up as her childhood self. She takes this event as a chance to change her life, and live without ties to both the crown prince and the saintess, but by a strange twist of fate, she becomes entangled with the saintess's childhood friend! A woman with a strong will to live who has been ensnared by fateーLiesel's success story begins here!"},"links":{"al":"155341","amz":"https://www.amazon.co.jp/dp/B0BJVK1CBB","bw":"series/357765","ebj":"https://ebookjapan.yahoo.co.jp/books/701099/","mal":"149797","mu":"0xqcnjs","nu":"prince-i-dont-want-to-be-killed-by-you-this-time-the-poor-lady-who-was-framed-by-the-saint-avoids-being-skewered-the-second-time","raw":"https://comic-days.com/episode/3270296674356433264"},"originalLanguage":"ja","publicationDemographic":"shoujo","contentRating":"safe","tags":[{"id":"0bc90acb-ccc1-44ca-a34a-b9f3a73259d0","name":{"en":"Reincarnation"}},{"id":"292e862b-2d17-4062-90a2-0356caa4ae27","name":{"en":"Time Travel"}},{"id":"423e2eae-a7a2-4a8b-ac03-a8351462d71d","name":{"en":"Romance"}},{"id":"a1f53773-c69a-4ce5-8cab-fffcd90b1565","name":{"en":"Magic"}},{"id":"cdc58593-87dd-415e-bbc0-2ec27bf404cc","name":{"en":"Fantasy"}},{"id":"d14322ac-4d6f-4e9b-afd9-629d5f4d8a41","name":{"en":"Villainess"}},{"id":"f4122d1c-3b44-44d0-9936-ff7502c39ad3","name":{"en":"Adaptation"}}]}
334b3730-21a7-4293-af2f-4875abd08ed1:::{"id":"334b3730-21a7-4293-af2f-4875abd08ed1","title":{"en":"Chanto Suenai Kyuuketsuki-chan"},"altTitles":[{"ja":"ちゃんと吸えない吸血鬼ちゃん"},{"ja-ro":"Chanto Suenai Kyuuketsuki-chan"},{"en":"Vampire-chan Can't Suck Properly"}],"availableTranslatedLanguages":["pt-br","en"],"relatedIdds":["23ebf5ec-719c-4f96-9a53-be0cea15ff90","23ebf5ec-719c-4f96-9a53-be0cea15ff90"],"description":{"en":"The overwhelming preciousness that captivates all those whose blood she sucks! A new kind of pampering and feeding comedy!","pt-br":"A preciosidade esmagadora que cativa todos aqueles cujo sangue ela suga! Um novo tipo de comédia de mimos e alimentação!"},"links":{"al":"132180","amz":"https://www.amazon.co.jp/-/en/dp/B09TD9SB17","ap":"chanto-suenai-kyuuketsuki-chan","bw":"series/321063","mal":"136467","mu":"181070","raw":"https://comic-walker.com/contents/detail/KDCW_FS01202222010000_68/"},"originalLanguage":"ja","publicationDemographic":"shounen","contentRating":"safe","tags":[{"id":"423e2eae-a7a2-4a8b-ac03-a8351462d71d","name":{"en":"Romance"}},{"id":"4d32cc48-9f00-4cca-9b5a-a839f0764984","name":{"en":"Comedy"}},{"id":"caaa44eb-cd40-4177-b930-79d3ef2afe87","name":{"en":"School Life"}},{"id":"d7d1730f-6eb0-4ba6-9437-602cac38664c","name":{"en":"Vampires"}},{"id":"dd1f77c5-dea9-4e2b-97ae-224af09caf99","name":{"en":"Monster Girls"}},{"id":"e5301a23-ebd9-49dd-a0cb-2add944c7fe9","name":{"en":"Slice of Life"}},{"id":"eabc5b4c-6aff-42f3-b657-3e90cbd00b75","name":{"en":"Supernatural"}}]}
ccb654fd-d4de-44d1-a9c1-f58ba34f3510:::{"id":"ccb654fd-d4de-44d1-a9c1-f58ba34f3510","title":{"en":"Fate/Grand Order - Daily Chaldea (Doujinshi)"},"altTitles":[{"en":"Daily Chaldea"}],"availableTranslatedLanguages":["en","pt-br","id"],"description":{"en":"Daily Chaldea is an unofficial daily slice-of-life fancomic created using art assets from the game Fate/Grand Order and building upon the existing lore of the franchise. The story follows the adventures of genderswapping protagonist Ritsuka Fujimaru and the many Servants they've summoned, with the tone ranging from comedic to philosophical. The comic is 'live' with the NA server of Fate/Grand Order, with new characters appearing in the comic around the time they appear in the game and comics often referencing recent events in the game. Enjoyment of this comic relies heavily upon the reader's familiarity with the game and its characters, so the author recommends playing Fate/Grand Order before reading this comic.    This comic is being uploaded to MangaDex by reader request and with the approval of MangaDex staff. All art is copyright TYPE-Moon / FGO Project, Aniplex Inc., Lasengle, and other copyright holders as appropriate. This comic is not for profit (through ad revenue or otherwise).    Some early use the original white backgrounds. Later comics have darker backgrounds and additional art assets for improved quality."},"originalLanguage":"en","contentRating":"safe","tags":[{"id":"891cf039-b895-47f0-9229-bef4c96eccd4","name":{"en":"Self-Published"}},{"id":"b13b2a48-c720-44a9-9c77-39c9979373fb","name":{"en":"Doujinshi"}},{"id":"e197df38-d0e7-43b5-9b09-2842d0c326dd","name":{"en":"Web Comic"}},{"id":"e5301a23-ebd9-49dd-a0cb-2add944c7fe9","name":{"en":"Slice of Life"}}]}
ffe69cc2-3f9e-4eab-a7f7-c963cea9ec25:::{"id":"ffe69cc2-3f9e-4eab-a7f7-c963cea9ec25","title":{"en":"Hitoribocchi no Isekai Kouryaku"},"altTitles":[{"en":"Loner Life in Another World"},{"ja":"ひとりぼっちの異世界攻略"},{"zh":"孤單一人的異世界攻略"},{"el":"Μοναχική επίθεση στον αλον κόσμο."},{"ru":"Нападение одиночки на иной мир"},{"zh-ro":"Duzi Yi Ren De Yi Shijie Gonglüe"},{"ko":"Wetol'i'eui Isegye Gongryag"},{"zh-hk":"獨自一人的異世界攻略"},{"ko":"외톨이의 이세계 공략"},{"th":"นายโดดเดี่ยวพิชิตต่างโลก"},{"en":"Lonely Attack on the Different World"}],"availableTranslatedLanguages":["es-la","pt-br","ru","en","vi","pl","id"],"description":{"en":"The strongest doesn’t need any cheats! Haruka, who spends his high school life a loner, was suddenly summoned to another world one day along with all his classmates. When ol’ God enters the picture, Haruka believes he can just choose whatever cheat skill he wants to help him survive in the new world… But, contrary to his expectations, that list of cheat skills works on a first come, first serve basis. And so, his classmates pick out all the cheat skills. His choices now limited to leftovers, Haruka finds himself incapable of assembling a party due to his own “loner” skill. Even though it’s a different world, it seems his adventuring days will be, as per usual, a solitary affair… After becoming aware of a crisis looming over his classmates, Haruka makes a silent vow to save them. No relying on cheats! He will walk a heretical path of strength that transcends the need for them.  \n  \nThe curtain rises on the strongest loner’s otherworld strategy guide!","es-la":"El fuerte no necesita trucos. Haruka, un estudiante de preparatoria quien gastó su vida como un \"solitario\", es convocado a otro mundo con sus compañeros de clases. Al ser convocado se encuentra con un \"Dios\", quien le da a escoger una habilidad, sin embargo... No era lo que esperaba encontrarse.","pt-br":"Exilado da classe? Checado  \r\n  \r\nSer transportado para um mundo alternativo com seus colegas? Checado  \r\n  \r\n Encontrar um Deus em uma espécie de Limbo entre os dois mundos? Checado  \r\n  \r\n Pegar uma skill roubada? Não gostaria de ser você, já foram todas vendidas.  \r\n  \r\n Essa história é sobre a aventura de um garoto solitário em um mundo alternativo, não agradecido a um Deus sênil que deu a ele todas as habilidades que não precisava."},"links":{"al":"107540","amz":"https://www.amazon.co.jp/dp/B084Z3G33G","ap":"hitoribocchi-no-isekai-kouryaku","bw":"series/219183/list","ebj":"https://ebookjapan.yahoo.co.jp/books/559608","engtl":"https://www.kaitenbooks.com/loner-life-in-another-world","kt":"54664","mal":"118251","mu":"152610","nu":"lonely-attack-on-the-different-world","raw":"https://comic-gardo.com/episode/10834108156661709864"},"originalLanguage":"ja","publicationDemographic":"shounen","contentRating":"suggestive","tags":[{"id":"36fd93ea-e8b8-445e-b836-358f02b3d33d","name":{"en":"Monsters"}},{"id":"391b0423-d847-456f-aff0-8b0cfc03066b","name":{"en":"Action"}},{"id":"423e2eae-a7a2-4a8b-ac03-a8351462d71d","name":{"en":"Romance"}},{"id":"4d32cc48-9f00-4cca-9b5a-a839f0764984","name":{"en":"Comedy"}},{"id":"87cc87cd-a395-47af-b27a-93258283bbc6","name":{"en":"Adventure"}},{"id":"a1f53773-c69a-4ce5-8cab-fffcd90b1565","name":{"en":"Magic"}},{"id":"aafb99c1-7f60-43fa-b75f-fc9502ce29c7","name":{"en":"Harem"}},{"id":"ace04997-f6bd-436e-b261-779182193d3d","name":{"en":"Isekai"}},{"id":"cdc58593-87dd-415e-bbc0-2ec27bf404cc","name":{"en":"Fantasy"}},{"id":"f4122d1c-3b44-44d0-9936-ff7502c39ad3","name":{"en":"Adaptation"}}]}
